{ "$schema": "https://developer.microsoft.com/json-schemas/fabric/item/report/definition/page/1.0.0/schema.json",
  "name": "page2", "displayName": "Detail", "displayOption": "FitToPage", "height": 720, "width": 1280,
  "filterConfig": { "filters": [ {
    "name": "Filter000000000000000000000002", "type": "Categorical",
    "field": { "Column": { "Expression": { "SourceRef": { "Entity": "Sales" } }, "Property": "Status" } },
    "filter": { "Version": 2, "From": [ { "Name": "s", "Entity": "Sales", "Type": 0 } ],
                "Where": [ { "Condition": { "In": { "Expressions": [ { "Column": { "Expression": { "SourceRef": { "Source": "s" } }, "Property": "Status" } } ],
                                                    "Values": [ [ { "Literal": { "Value": "'Done'" } } ] ] } } } ] } } ] } }
